{
  "$schema": "../schema/config-schema.json",
  "project": {
    "name": "my-project",
    "slug": "my-project",
    "repository": "/home/user/projects/my-project",
    "orchestration_dir": ".czarina",
    "version": "1.0.0",
    "description": "Basic project without new v0.7.0 features"
  },
  "workers": [
    {
      "id": "backend",
      "agent": "claude",
      "branch": "feat/backend",
      "description": "Backend API implementation",
      "token_budget": 2000000
    },
    {
      "id": "frontend",
      "agent": "cursor",
      "branch": "feat/frontend",
      "description": "Frontend UI implementation",
      "token_budget": 1500000
    }
  ],
  "orchestration": {
    "mode": "local"
  },
  "daemon": {
    "enabled": true,
    "auto_approve": ["read", "write", "edit", "commit"]
  }
}
